id,external_id,message_preview,hash,published_at,created_at,source_id,source_name
20169,7302,"Не дошли до шорта немного )

Ну ладно, в текущей з... боковике, и до 97-98к я могу аккуратно доливаться",8cba43cfc03cd350ec3866df96a60180,2025-10-30T12:28:48+00:00,2025-11-16T14:31:57.022706+00:00,105,t.me/mr_mozart
20193,7301,"Одновременно с этим, ставлю лимитку шорт по 119349...ся буду вручную

СТ нужен для расчета размера позы",dfd519ae17a0da1dc317a8f272c514fd,2025-10-27T11:18:22+00:00,2025-11-16T14:31:57.231255+00:00,105,t.me/mr_mozart
20184,7300,#btc_07_10 - ставлю лимитку на продажу полного объ...лимитка снизу - КЛАЦ) и потом перевернуться в шорт,43cc76f8bb06dc9f71de1a374ce80acc,2025-10-27T11:13:09+00:00,2025-11-16T14:31:57.174748+00:00,105,t.me/mr_mozart
