id,external_id,message_preview,hash,published_at,created_at,source_id,source_name
24744,24419,"ZEC short is performing well — price has hit $595,...loss to lock in gains while letting the trade run.",2c5dd33d61c2a8596aede57d255c4b08,2025-11-21T14:42:53+00:00,2025-11-21T16:04:58.071086+00:00,158,t.me/CryptoVIPsignalTA
24736,24418,"Revisiting key valuation models, Bitcoin has enter...signal that bearish momentum is firmly in control.",060d8474617b6e04f59f565ee7c7287e,2025-11-21T13:26:01+00:00,2025-11-21T16:04:57.761632+00:00,158,t.me/CryptoVIPsignalTA
24740,24417,"SOL has reached a major support area, and this is ...n the spot market or use a maximum of 3x leverage.",5972d68a109ef10836beb83cc834a7f5,2025-11-21T11:31:01+00:00,2025-11-21T16:04:57.905167+00:00,158,t.me/CryptoVIPsignalTA
24743,24416,ZEC has dropped after testing the resistance area.... loss. We expect a decline towards the $550 level.,dbb2786925be8a963f69b6b8f6e3c4d8,2025-11-21T09:55:38+00:00,2025-11-21T16:04:58.063599+00:00,158,t.me/CryptoVIPsignalTA
26931,24428,"NEWT analysis: 

Price is forming a double bottom ...ow the $0.10 level.

Support Area: $0.1050-$0.1100",cc5a1c88368e07c4e237b900087d7239,2025-11-22T17:58:01+00:00,2025-11-22T18:05:31.027997+00:00,158,t.me/CryptoVIPsignalTA
26924,24426,BTC realized losses have spiked to levels not seen...yers exit their positions into the sharp drawdown.,b1c65734b80ed806fb066c030a978ef5,2025-11-22T12:36:01+00:00,2025-11-22T18:05:30.704621+00:00,158,t.me/CryptoVIPsignalTA
26925,24425,METIS has retested the resistance area and faced a...ainder of your position with a trailing stop loss.,8b22583f2e475af13f493fd3fb6c1c23,2025-11-22T11:29:01+00:00,2025-11-22T18:05:30.752736+00:00,158,t.me/CryptoVIPsignalTA
26927,24424,"The ZEC short position is performing exactly as we...s. Additionally, consider booking partial profits.",2eaa79eebd321683d87f0eb4e148e4ce,2025-11-22T08:29:01+00:00,2025-11-22T18:05:30.787866+00:00,158,t.me/CryptoVIPsignalTA
26928,24423,"Market Keeps Torturing the Longs

In the past 24 h... crushed. Stay cautious and manage risk carefully.",69770f85af8854242f724d5fcec54c37,2025-11-22T07:55:33+00:00,2025-11-22T18:05:30.916593+00:00,158,t.me/CryptoVIPsignalTA
26929,24422,"Bitcoin has bounced back from the $80,000 support ...again, it could trigger a cascade of liquidations.",815115915cd268ba9bb664bb59febcf9,2025-11-22T06:39:01+00:00,2025-11-22T18:05:30.999372+00:00,158,t.me/CryptoVIPsignalTA
26933,24421,"HBAR analysis: 

The price is currently testing a ...pport Area: $0.125-$0.135

Stop Loss: $0.115 level",4b084d3581856684e2cb7f1f9d9f9e77,2025-11-21T18:21:01+00:00,2025-11-22T18:05:31.053266+00:00,158,t.me/CryptoVIPsignalTA
